ID,Description
33,"Once considered an afterthought or a bonus space, outdoor living areas are now more mainstream, and a desirable feature among many of today’s home buyers. One driving force behind the trend is the pandemic-induced shift in priorities when it comes to the home. Updating your property with a deck or other outdoor room that is fun as well as functional not only expands your usable living area now, it also adds value if you decide to put your home on the market.

According to the Remodeling 2022 Cost vs. Value Report, the average cost to add a wood deck to a property is about $19,000, and homeowners can expect to recuperate nearly 65 percent of that cost when selling their home. This estimate is for a 16 by 20-foot deck with pressure-treated joists and planks. A composite deck is slightly more expensive, but it also brings in an excellent return on investment (ROI) of about 62 percent.

Along with a deck, there are many other features to consider when updating your outdoor living space—from landscaping to sun protection to accessory buildings and more. We’ve put together a collection of articles that cover everything you need to know about refreshing your yard, whether you’re planning to sell your home in the near future or simply looking to spruce it up for your own enjoyment. The following ideas, cost estimates, shopping guides, tutorials, and other important considerations will help you plan an outdoor living space update that’s right for your home and budget.

Deck
Installing a new deck (or replacing an old one) is one of the most impactful projects homeowners can do to improve their backyard. When planning this addition, however, there are countless decisions to be made, from the type of materials used to the square footage and aesthetic design. It’s important to consider how much money you want to invest as well as how much maintenance the deck will require after it’s built. Consult the guides below to learn about the pros and cons of different decking materials, how much the project costs on average, as well as how to design, build, and maintain a deck yourself.

Patio

A patio is a popular alternative to a deck, as it’s typically cheaper to build and easier to maintain over time. Like a deck, a patio can function as an outdoor living room suitable for entertaining, or it can simply be a place for relaxing in the open air when the weather is nice. If you’re considering a patio for your backyard, one of the most important decisions to make is the material. Pavers or a simple concrete slab are two popular choices today, and each comes with different costs and installation methods as well as different aesthetics.

Shade

Planning a covered outdoor living space is prudent in warmer climates where shade is necessary on hot, sunny days. Adding cover to a deck or patio can be done in a number of different ways, from pergolas and gazebos to awnings and shade sails. For a more natural look, you could even consider planting fast-growing shade trees in strategic locations around the yard. The following articles provide outdoor living ideas that will inspire you to add sun protection to your landscape.

Landscaping

When selling a home, it’s important to make a good first impression. Great landscaping not only provides curb appeal for prospective buyers, but it also increases the value of a home. Planting trees and shrubs can improve air quality and privacy while simultaneously making an outdoor living space more aesthetically appealing. The articles below include landscaping ideas for different types of yards, cost estimates for various lawn and garden projects, and tips and tricks for planting and pruning outdoor greenery.

Accessory Building

An accessory building can add storage space and functionality to a yard, and it can even be a source of income. If you’re considering adding a shed, an accessory dwelling unit (ADU), or any other outbuilding to your property, there are a number of practical factors to keep in mind. For example, many municipalities have setback and building-permit requirements based on the type of structure you plan to add. Read up on these important considerations and more before adding an accessory building to your property."
34,"You may not have heard the term, but flat-front homes are easy enough to spot: They're the homes on your street, usually colonials, that appear one-dimensional. They lack depth, ornamental features, and landscaping, and a lack of porches and awnings paired with a homogenous color palette often defines the appearance of these homes.

""The thing about flat-front houses is that they suggest that the people who live there don't take pride in their home,"" says DC-based interior designer Annie Elliot. ""And so if you are listing your house, the one dimension really does not does not help your cause.""

Anyone with a flat-front house probably does take great pride in their home—but not knowing how to dress up a lackluster exterior will prevent even the most diligent homeowner from showing off the front yard of their dreams.

While the flat-front home problem is purely aesthetic, when it comes to selling the property, the problem can be become one of sellability. That's because curb appeal often brings potential buyers in the door. A beautiful exterior is the secret to getting potential buyers to stop scrolling home sites, peek through the rest of your photos, and make a decision to schedule a tour or put in an offer. Owning a flat-front house doesn't resign you to a lengthy selling process, though: Whether you're ready to list your home or not, there are simple ways to upgrade your flat-front home and make it the prettiest spot on the block.

Dramatic Solutions for Your Flat-Front House
If you have time and money to make over your flat-front home, there are a few areas you'll want to focus on.

Elliot suggests starting by adding dimension to the home itself. You can do this by adding shutters or awnings if they fit the style and era of the home. (Don't do this with a modern home, for example.) You can spruce up your front steps or add new ones. A walkway through the front yard to the front door will increase curb appeal, as well.

""If you don't have any approach to the house, that's something you probably want to consider,"" Elliot says. ""Try putting down brick or flagstone.""

Elliot also recommends focusing on landscaping—this is where you'll want to hire a pro.

""A front garden, curved beds—with or without stone or brick edging—they add beauty, dimension, and interest,"" Elliot says. ""So if you don't have a green thumb, engaging a landscaper is really worth every penny.""

Elliot suggests adding at least two curved beds to add depth to the yard and thinking outside the box with bushes: Flat rows of shrubs will only make the problem worse. Instead, vary the height and shape of your plantings and be sure to include some evergreen options so your landscaping stays in good shape year-round.

If you have a larger budget to play with, Elliot says a front porch will truly solve the one-dimensional problem. Adding a porch is a pricey and time-consuming fix, though, and if you're updating the house to sell it, you'll likely regret not having the porch sooner to enjoy yourself.

Budget Fixes
If you don't have the time or money to fix your flat-front house with major additions or landscaping, there are still some budget-friendly options to improve its curb appeal.

Elliot suggests going with potted plants or potted trees and spacing them a few feet in front of your front door on either side: There's no landscaping pro required for this upgrade, and you can take the plants and pots with you when you move.

""I do suggest looking at home improvement stores for resin or plastic terracotta look-alikes, which are far lighter and easier to move than concrete or metal and far less expensive,"" she says.

Paint can also go a long way to add curb appeal, Elliot says. Try redoing the front door in a bold color and painting any existing shutters with a fresh coat.

Patsy Rios Franzi, a real estate agent with Better Homes and Gardens Real Estate Universal, suggests painting the trim, too. ""If there's any kind of trim around the house, making it a different contrasting color [than the siding] will really make the front of the house pop,"" she says.

Don't want to buy paint? Then elbow grease is the best route. Elliot says, at a bare minimum, you can clean your siding, sweep your porch, and straighten any loose or crooked shutters.

""Sometimes all you need is a power wash to make everything look brighter,"" she says.

Courtney Klosterman, consumer insights expert for home insurance services company Hippo, also suggests fixing driveway cracks, enhancing lighting, and replacing old gutters and downspouts. The benefit of these enhancements is that they not only improve the look of your flat-front home, but also improve the home from a safety and structure standpoint.

""Not only will this make your home look cleaner, it will be beneficial for the new homeowners,"" Klosterman says.

If you don't want to lift a finger, Rios Franzi suggests swapping exterior photos for better features in your listing.

""The first pictures are usually the front of the house,"" she says. ""But if it's really bad off, my first picture will either be of the backyard if it's really nice, or an interior photo of something like the living room.""

This should be a last resort, Rios Franzi says, because most buyers expect to see the exterior of a home before scheduling a tour.

The Return on Investment
If you make these improvements, real estate agents say you can expect to see a return on your investment.

""You'll see a return in many ways, and not necessarily in dollars,"" Rios Franzi says, adding that some upgrades might be essential to making a sale at all. At the very least, you'll increase traffic to your home from potential buyers who aren't turned off by the exterior photos.

""Everybody who passes the house with the for sale sign is a potential buyer or a potential referrer, so it is critical that the front of your house look appealing,"" Elliot says.

In a hot housing market, you might sell your home regardless of the flat-front problem, but you'll never know how much you might have fetched with increased curb appeal.

""You're lucky, because in today's market you don't need to do a lot to sell,"" Rios Franzi says. ""But I still recommend [upgrades to boost curb appeal], because it's my job to get you top dollar.""

Whatever you do, whether it's a makeover or clever listing photos, make sure you address the curb appeal factor.

""You can't ignore a flat-front house,"" Elliot says. ""That's the bottom line."""
35,"While these factors add up from the investors’ viewpoint, the final success story involves additional characters. It was easier to gauge the success or failure rate until the COVID-19 pandemic crushed the entire world, impacting not only animate humans but also inanimate things like real estate.

If you are considering a property investment, it is crucial to consider the pandemic’s impact. The global outbreak has compelled many people to rethink how long they can stay in their present homes before having to relocate to a new and safe location. 

In communities where a large number of people were infected, many individuals are considering selling their houses as a preferred option so that they do not miss out on the early profits or lack of demand down the road.

Moreover, strict norms to curb the spread of the virus have made it difficult for both property sellers and buyers to engage in frictionless transactions. Immediate repercussions include shockingly declined property sales, an abrupt increase in cost and people abandoning their properties in the metro cities, throwing the market into a depressing state.

Currently, the real estate market is in a volatile state and witnessing change on different levels. With the abrupt change in policies of governments, the real estate market is in flux, which affects its stability. Owning a property is getting more challenging for people due to the rising interest rates on mortgages.  

Still, people are looking for ways to make money with property investment. If you are one of them, then the following tips will help you create the right mindset and plan.

Select The Right Location
Selecting the right location for your next property is half the battle won. The location should cater to everyday needs by being close to grocery stores, restaurants, cafes and public transport.

By choosing the right location, you kill two birds with one stone, i.e., better resale value and higher rental income. Right location means having all the amenities nearby, which allows you to quickly sell your property once you decide to move on – best if you have a money-making mindset.

Moreover, the value of property bought in the right location and at the right time will rise over the years due to appreciation and capital growth. The demand will also grow because of new development projects like residential buildings or shopping centres being built nearby.

Get Proper Insurance
Getting the proper insurance is essential when you consider investing in a property. Insurance should not just be for your home. It is equally feasible for your next property. But the question arises – why is insurance crucial for your property?

There is a multitude of reasons for having your property insured. Without proper insurance, it will be next to impossible to get compensation for mishaps like a fire or burglary. It is safe to say you will have to bear the burden of any untoward events alone.

Also, it is recommended for landlords to get insurance by paying a small subscription fee to an insurance company today and get a guarantee in exchange. It comes in handy if you are planning to rent out your property to tenants. Insurance companies will be responsible for bearing any large and uncertain loss that may happen due to mishaps caused by tenants.

Define Your Investment Goals
Understanding your investment goals is the next big step in your path toward making a profit from your property. Defining these goals is not easy. You need to be realistic and measure your goals in the long term.

That means if you are looking for at least 20% appreciation per year, which might not be very realistic considering the property location and current circumstances, then you need to be more practical in your approach.

Also, you should stick to a time-bound strategy when it comes to investment goals. It would mean forging a strategy that includes both buying a property and selling it at the right time, allowing you to attain your investment goals more quickly and efficiently. This way, you will likely save yourself risks that might occur during your ownership period.

Lastly, you should be more specific in your investment goals, which enables you to clearly navigate your property investment journey and fulfil your goals without any fuss or additional cost. If you are clear and realistic in your investment goals, then there are good reasons to invest in property right away.

Analyse Financing Options
Analysing the available financing options will place you in a better position wherein you can better understand and anticipate the overall interest and other crucial factors. It requires extensive research on your part, so that you know the current interest rates and check their feasibility.

Checking your credit score is an essential part of this step. That is because lenders are likely to prefer individuals with satisfactory credit scores. But what if your score is not up to the mark?

Fret not. If that is the case, you should be quick to implement the steps and improve your score, which will save you during the tedious approval or pre-approval process.

Another financing option could be a home equity loan, wherein you can secure an investment property. This option usually offers around 80% of the home’s equity value, which you can use to buy your next dream property. 

Consider Long-Term Expenses
Considering long-term expenses is the next step if you are looking to accrue some financial benefits from your investment. Carefully think through the different expenses that aren’t included in the initial purchase price. These expenses include maintenance and renovation, property taxes, annual insurance charges and more.

To get an estimate of these expenses, you need to analyse the previous bills and communicate with homeowners who have been living in the neighbourhood.

Hence, it becomes all the more important to keep in mind these long-term expenses before plunging into a seemingly optimistic property investment market. That means analysing whether you will get a higher monthly rent or mortgage than the monthly cost of maintenance and repairs.

By taking into account all these factors, you can make a more informed decision that will not only be right for your investment needs but will also give you fewer headaches down the line.

Conclusion
Investing in a property can be a lucrative option once you keep these tips in mind and make your decision based on all the factors listed above. In the post-pandemic world, the outlook of property investment is gradually becoming promising, making it great even for beginner investors.

For those looking to buy property as an investment, make sure you do not put all eggs in one basket, meaning do not invest every penny in your next dream property. It might prove dangerous if your property fails to give you the desired rental income, which happens in many cases. So, place your mindset in the correct order and stay in the game for the long term to survive and win in the end."
36,"U.S. new-home sales jumped unexpectedly in May despite rising mortgage rates, while the median sales price declined.  

The pace of new single-family home sales rose 10.7% from April’s upwardly revised number to a seasonally adjusted, annual rate of 696,000, while the median sales price fell to $449,000 from April’s revised median house price of $454,700, the U.S. Census Bureau and the U.S. Department of Housing and Urban Development reported. Economists had been expecting new-home sales would fall to a rate of 588,000, according to Reuters. 

On a year-over-year basis, the pace of new-home sales in May was down 5.9%.    

“As pricing begins to show signs of softening and builder inventory increases, there is potential for sales to remain consistent at this level or possibly increase slowly through the summer — because the market remains under-built, and fewer households are putting their existing homes on the market,” RCLCO Real Estate Consulting principal Kelly Mangold said. “This decline in for-sale mobility may bode well for the rise of the build-for-rent sector, as an increasing number of households seeking a for-sale home may instead choose to rent a single-family home or townhome while they wait for market conditions to become more favorable.” 

The seasonally adjusted estimate of new homes for sale at the end of May was 444,000, representing a supply of 7.7 months at the current sales rate. In April, there were 437,000 homes for sale, representing an 8.3-month supply.       

By region, the number of new-construction homes sold was mixed, with month-over-month increases of 39.3% and 12.8% in the West and South, respectively, and decreases of 51.1% and 18.3% in the Northeast and Midwest, respectively. 

First American Deputy Chief Economist Odeta Kushi cautioned not to read too much into the surprise jump in sales. 

“The monthly increase in new-home sales beat consensus expectations, but new-home sales data is volatile and one month does not make a trend,” she said in a press release. “While the nation continues to face a housing shortage, new-home sales may slow as worsening affordability and higher construction costs take a toll on the new-home market.”"
37,"Despite a cooling demand, the prices for Virginia homes continues to climb, according to Virginia REALTORS®.

The statewide median sales prices for a home in May was $401,082, up 8.7 percent from one year ago.

This is the first time Virginia’s median home price has climbed beyond the $400,000 mark.

In May 2022, 13,048 homes were sold in Virginia, an 8.5 percent decrease from last year.

While sales activity rose between April and May, Virginia REALTORS® reports this is due to a typical seasonal bump.

Nearly all regions in Virginia are experiencing a cooling housing market through the first five months of the year compared to last year.

“The moderating trend we are seeing reflects not only a return to more normal levels, but also a cooling of demand from home buyers,” says Virginia REALTORS® chief economist Ryan Price. “Buyers are feeling the weight of surging home prices, high inflation, mortgage rate jumps, and an extremely competitive market with few options to choose from.”

Statewide, there were 16,875 active listings on the market at the end of May, a 5.6 percent decrease from last year. This is the smallest decline in three years.

Additionally, the number of active listings at the end of May was 9 percent higher than the end of April – an increase larger than a typical seasonal bump.

The Virginia Home Sales Report is published by Virginia REALTORS®. Click here to view the full May 2022 Virginia Home Sales Report."
38,"Canada’s new homes market is showing strength, based on the latest data from May, with multi-family development leading the way.

Home starts data from last month outpaced analysts’ expectations with an annualized figure of 287,000 units, exceeding forecasts of a slight slowdown to 255,000 units, a recent report from CIBC Economics stated.

May’s rise in starts was driven by multi-family builds, rising by 13 per cent from the previous month. All told, multi-family starts accounted in May for about 201,000 starts per annualized rate, as noted in a separate report from TD Economics.

By comparison, single-family detached starts made up about 63,000 starts on an annualized basis, gaining four per cent in May on a month-over-month basis.

Five out of 10 provinces saw starts rise, with Ontario making up the most significant share of new starts at nearly 89,000 units, up by about 11,000 starts. The Prairies region also had strong growth, increasing by 3,700 units in May from April to about 56,000 starts on an annualized basis, led by Alberta, the TD report stated.

The report noted that despite cooling resales and prices in many parts of the country, builders continue to add supply “at a very healthy clip” due in part to the lag between development and quick-shifting residential market conditions.

Strong activity, it added, should continue for the rest of the year based on elevated permitting data. Yet starts are forecast to trend lower next year due to higher financing costs, including mortgages, that will weigh on Canadian homebuilders."
39,"A realtor says national headlines about high home prices are misleading: Edmonton is an attractive place for first-time buyers.

“When they’re speaking of market prices, they’re not speaking of Edmonton in general, they’re generalizing using the two biggest cities in Canada,” said realtor Wally Fakhreddine.


Fakhreddine says national news centres around Toronto and Vancouver. He says Alberta – and particularly Edmonton – has a lot to offer young and first-time home buyers.

“Calgary is about 30 per cent higher in price points than we are,” said Fakhreddine. “It’s very easy to get into a nice home here for around the $400,000-$500,000 mark, which is the price point for a lot of first-time home buyers.”

A recent report from Sotheby’s shows Edmonton is the second most affordable city in North America when it comes to average rent prices. Winnipeg takes the top spot.

And with young Albertans in the 20s starting to enter the housing market, the report also shows 86 per cent of those surveyed in Calgary wanted to buy a home in the city.

Fakhreddine says work opportunities are bringing people to resource-rich Alberta instead of other parts of Canada.

“Alberta has always fared better economically than other parts of the country, and Edmonton in particular because it’s the gateway to the north. And that’s what’s bringing in people from other provinces – gainful employment, not just employment.”"
