ID,Description
58,"You may be reading headlines and hearing talk about a potential housing bubble or a crash, but it’s important to understand that the data and expert opinions tell a different story. A recent survey from Pulsenomics asked over one hundred housing market experts and real estate economists if they believe the housing market is in a bubble. The results indicate most experts don’t think that’s the case.

As the graph shows, a strong majority (60%) said the real estate market is not currently in a bubble. In the same survey, experts give the following reasons why this isn’t like 2008:

The recent growth in home prices is because of demographics and low inventory
Credit risks are low because underwriting and lending standards are sound
If you’re concerned a crash may be coming, here’s a deep dive into those two key factors that should help ease your concerns.

1. Low Housing Inventory Is Causing Home Prices To Rise

The supply of homes available for sale needed to sustain a normal real estate market is approximately six months. Anything more than that is an overabundance and will causes prices to depreciate. Anything less than that is a shortage and will lead to continued price appreciation.

As the graph below shows, there were too many homes for sale from 2007 to 2010 (many of which were short sales and foreclosures), and that caused prices to tumble.

Inventory is nothing like the last time. Prices are rising because there’s a healthy demand for homeownership at the same time there’s a limited supply of homes for sale. Odeta Kushi, Deputy Chief Economist at First American, explains:

“The fundamentals driving house price growth in the U.S. remain intact. . . . The demand for homes continues to exceed the supply of homes for sale, which is keeping house price growth high.”

2. Mortgage Lending Standards Today Are Nothing Like the Last Time

During the housing bubble, it was much easier to get a mortgage than it is today. Here’s a graph showing the mortgage volume issued to purchasers with a credit score less than 620 during the housing boom, and the subsequent volume in the years after:

This graph helps show one element of why mortgage standards are nothing like they were the last time. Purchasers who acquired a mortgage over the last decade are much more qualified than they were in the years leading up to the crash. Realtor.com notes:

“. . . Lenders are giving mortgages only to the most qualified borrowers. These buyers are less likely to wind up in foreclosure.”

Bottom Line

A majority of experts agree we’re not in a housing bubble. That’s because home price growth is backed by strong housing market fundamentals and lending standards are much tighter today. If you have questions, connect with a local real estate professional to discuss why today’s housing market is nothing like 2008."
59,"After reporting steep drops in U.S. pending home sales over the past several months, the National Association of Realtors released a report on Monday showing an unexpected rebound in pending home sales in the month of May.

NAR said its pending home sales index climbed 0.7 percent to 99.9 in May after plunging by 4.0 percent to a revised 99.2 in April. The increase surprised economists, who had expected pending home sales to tumbled by another 3.7 percent.

A pending home sale is one in which a contract was signed but not yet closed. Normally, it takes four to six weeks to close a contracted sale.

""Despite the small gain in pending sales from the prior month, the housing market is clearly undergoing a transition,"" said NAR Chief Economist Lawrence Yun. ""Contract signings are down sizably from a year ago because of much higher mortgage rates.""

The unexpected increase in pending home sales came as pending home sales in the Northeast spiked by 15.4 percent compared to the previous month.

Pending home sales in the South also edged up by 0.2 percent, while pending home sales in the Midwest slumped by 1.7 percent and pending home sales in the West plunged by 5.0 percent.

""The largest decline in contract activity was observed in the West region, where homes are the most expensive,"" Yun said.

He added, ""This further indicates the growing need to increase supply to tame home price growth and improve the chances of ownership for potential home buyers."""
60,"In the fraught, pressure-packed, scarily unpredictable summer 2022 housing market, home sellers and buyers are compulsively tracking key real estate metrics like baseball obsessives tracking box scores—only with way more on the line than the galling perfection of the New York Yankees. Everyone is desperate to get a grip on where things are going in U.S. real estate. Are prices continuing to rise? Is inventory going to keep falling? And where on Earth are mortgage rates going to top out?

But one stat seems to sum up the current market, with all of its twists and turns, better than any other: How long is it taking for homes to sell? And in another sign of a cooldown in the housing market, U.S. homes are remaining on the market just a little longer.

While still a blistering pace, it represents a relief from the turbocharged frenzy we saw late last year and earlier this year. At the beginning of 2022, the median number of days on the market was just 21—10 days faster than it is now.

“The big trend that we’ve seen just about nationwide is that homes are not sitting for very long anywhere,” says Danielle Hale, chief economist for Realtor.com. “We have relatively few homes on the market for sale, and up until recently, buyer demand has been really intense. But there have been some signs that demand is cooling.”

Why demand is truly cooling
Hale says data shows more sellers are popping up in a number of markets nationwide. She believes some of those folks held off on putting their homes on the market in 2021 because of continued uncertainty with the COVID-19 pandemic.

It might seem like a story from a long time ago in a galaxy far, far away. But dial the calendar back 12 months, and vaccines were just ramping up with the masses getting their first jabs last spring. Questions about the effectiveness of the vaccines lingered and it was still unclear if (and when) most of the country would be ready to open back up.

This spring, we’re now headed back to what looks like equilibrium.

“This is the first relatively normal year since the start of the pandemic. I think a lot of people were afraid they were going to miss the heart of the selling season last year and just decided to postpone their home sales,” says Hale. “They weren’t quite ready to make moves last year—and they definitely are now.”

In another hopeful sign for buyers, Hale cited data that shows the number of home sellers has increased year over year for 10 out of the past 11 weeks. More folks putting their places up for sale means more options for buyers who were weary of tiresome bidding wars.

Days on the market are starting to climb
A national median of 31 days on the market doesn’t provide buyers with a ton of breathing room. But as Hale explains, it’s a marked difference from that head-spinning 21-day median seen earlier this year. She expects the pace to slacken even more with interest rates rising.

“In the most recent week, homes sold just four days faster than they did last year,” Hale says. “They’re still selling faster than a year ago, but that gap is shrinking, and eventually I expect to see homes sell a bit slower than last year.”

More days on the market can mean buyers have more time to decide if a house is right for them and get the financing together. Buyers might not feel pressured to make a purchase they might regret down the line. Bidding wars will be less frequent and less frantic.

Be wary of using the number of days on the market to predict the future, Hale cautions.

“Days on market is a bit more of a lagging indicator than a leading indicator, so it’s not generally the first metric to change, but it is one that signals market balance.”

So where are homes still moving fast—and where are they sticking around longer?
With that caveat in mind, we took a look at the 10 markets where homes are selling the quickest and the 10 where they’re lagging a bit behind the national median.

To create our list, the data team at Realtor.com scoped out the median days on the market in May for the nation’s 250 largest metropolitan areas. To ensure geographic diversity, we limited the data to one metro area per state. Metros include the main city and surrounding towns, suburbs, and smaller urban areas.

Cities don’t tend to stay on these lists for long.

“When a housing market has homes selling extraordinarily quickly, market forces tend to bring it back into balance, either through more supply from existing-home owners selling or builders building, or through reduced demand, homeowners shifting to other, less competitive markets,” Hale explains.

That said, we did spot a couple of holdovers from last year’s look at the fastest and slowest markets, including the city that holds the crown for the fewest median days on the market. What’s in the water in New Hampshire, anyway?

Where homes are selling the fastest

1. Manchester, NH

Median list price in May 2022: $444,900
Days on the market: 8.5

The market where homes turned over the quickest is a historic city about 50 miles from Boston. A lack of housing starts might be a key component of Manchester’s rapidly moving market.

“There aren’t a lot of new-construction houses here in Manchester. We’re part of the original 13 Colonies, so a lot of our housing is dated prior to the industrial era, 1800s to 1940s,” says Suzanne Damon of the Damon Home Team at Re/Max Insight in Manchester.

“Demographic-wise, we have a large portion of millennials in our population, but we do tend to attract the baby boomers because there’s no state income tax,” she says.

Recently, Damon says she has started to see a shift.

“Interest rates started to rise in April, and that’s when we started to see a change in our market,” she says. “Last year, my offer count per listing was 12 offers versus today, it’s five and a half.”

That means the buyer—especially a first-time buyer—with a traditional mortgage or a government-backed loan like FHA, USDA, or VA, now has a fighting chance in what had been a cash-heavy market.

“Last year, 33% of my properties sold were cash. I see this [current market] as being very opportunistic for buyers who don’t have a lot of cash to come to the table,” Damon says. “These buyers who haven’t been able to buy, with a little bit of a cooldown in the market, they’re going to be able to come to the table, and we’ve seen that in the last three weeks.”

2. Raleigh, NC

Median list price: $493,558
Days on the market: 9

Not too far behind was Raleigh, with a median of nine days on the market.

Raleigh is a key part of the Research Triangle area along with the cities of Durham and Chapel Hill. Three major research universities in the area mean it’s a hub for employers on the lookout for well-educated workers.

Low inventory has been an issue in the market, says Matt Fowler, executive director of Triangle MLS. He says more area houses sold in 2021 than in any year before—and that pace has kept up this year so far.

“Think of it as a retail store. It’s not like there’s not stuff on the shelves. The shelves are full, and they’re turning so fast that it’s hard to keep them stocked,” he explains. “So there’s less inventory visible, but you can [still] find and buy a house.”

Prior to the pandemic in June 2019, the Raleigh area had 10.8 months of housing inventory to work through. Fowler says the number now sits at 3.3 months.

In an interesting twist, Fowler adds that homes priced at $250,000 or lower are staying on the market a bit longer than homes priced above $470,000. Buyers from out of state want the nicer homes and are ready to pony up the dollars it takes to win a bidding war.

“There are very publicized employment relocations that have occurred,” he says, adding that tech companies such as Apple, Google, and Meta are bringing new workers to the Triangle, with many having salaries in the $200,000 range.

3. Rochester, NY

Median list price: $224,950
Days on the market: 10 (Tie)

Tied for third at a quick 10 days on the market is this intriguing upstate New York market where buyers still must act fast. Local agents say there’s a continued shortage of homes up for sale, with one local agent reporting there are “10% as many homes as there were available in 2015” in the metro area.

The city consistently ranks high for livability and gets a ton of lake-effect snow every winter thanks to its proximity to Lake Ontario. The median list price remains friendly, which means buyers continue to make their way to this town on the rebound.

4. Denver, CO
Median list price: $695,000
Days on the market: 10 (tie)

Also at a rapid 10 median days on the market is the Mile High City. While inventory turned over rapidly in May, red flags in the area are already apparent.

The median closing price on a home fell in May, and a “day of reckoning” could be on the horizon for this potentially overvalued metro, some insiders believe.

5. Burlington, VT

Median list price: $439,250
Days on the market: 11

On the list at No. 5 is Burlington, with homes on the market for a median of 11 days. It’s not a huge shock: The city ranked second in our look at May’s hottest real estate markets.

With a median price that’s just a hair above the national median, buyers continue to flock to this town near the Canadian border. The hurdle is the same as we have seen in Manchester, NH: There just aren’t enough homes on the market right now. When a desirable home pops up, it flies off the market in a hurry.

Rounding out the top 10 are Columbus, OH, at 14; Nashville, TN, and Columbia, MO, tied at 14.5 days; and Portland, ME, and Worcester, MA, tied at 15 days.

Where homes take the longest to sell.

1. Houma, LA

Median list price: $284,500
Days on the market: 58.5

Houma tops the list for the slowest market. Even so, the number is down significantly from the median 79 days on the market in April of last year. Local agents have seen the sign of market strengthening.

“Right now anything from $130,000 to $140,000 to the $200,000 range priced right and is a nice house, those things are like war. You’re going to expect a multiple-offer situation on that,” explains Lisa Thibodaux with Latter & Blum Canal & Main Realty in Thibodaux, LA, which is next to Houma.

Many of those lower-priced residences are being bought for students attending nearby Nicholls State University.

“We have a lot of families looking for housing for students versus them renting. With the high price of rent, they’ll purchase a little house no higher than $200,000 for their kids to come to school,” she says. “Then they turn it around and put it back on the market. I’ve done many of those where, after the child is out of school, they give it back to me to put on the market.”

Thibodaux says both the pandemic and Mother Nature have contributed to the out-of-whack market around Houma.

Hurricane Ida hit the area with 150 mph winds in August 2021, damaging or destroying many homes. Many of those homes were in a flood zone and cannot be easily rebuilt or insured.

Owners “are definitely trying to get out of the flood zone right now,” she says.

2. Utica, NY
Median list price: $182,400
Days on the market: 55

This spring, homes in Utica were selling at close to the asking price. Seller supply was almost even with buyer demand, which means buyers have a bit more leeway in this upstate burg.

Foreign refugees have flocked to the unlikely locale of Utica with the help of The Center, an organization that helps people resettle from countries around the world. A recent New York Times article looked at how those refugees were helping to transform this “dying Rust Belt town.”

3. Iowa City, IA

Iowa City, IA(Getty Images)
Median list price: $319,900
Days on the market: 51.5

Need time to pick the home of your dreams? Head to this college town where the pace is more leisurely. Homes in the land of the Iowa Hawkeyes average nearly two months on the market. Still a friendly market in terms of both price and availability, demand and supply are fairly evenly matched.

Right now, there are nearly 500 homes on the market in the town—and over 300 of those are priced below $400,000.

4. Charleston, WV
Median list price: $151,200
Days on the market: 50

In this capital city, it’s still possible to score a home with a five-digit price tag. The median sale price in Charleston was $94,000 in April 2022. It’s no wonder West Virginia recently topped our list of the most affordable states for homebuyers.

The state’s most populous town sits right along the Kanawha River and has over 400 homes for sale. Just over 150 of those homes have an asking price below $100,000.

5. Salisbury, MD
Median list price: $499,900
Days on the market: 49.5

In 2021, we named it the best college town for families to buy a home. Salisbury University is the city and has a 200-acre campus and more than 8,000 students.

With nearly 500 homes currently on the market and no homes priced over a million bucks, buyers have plenty of places to choose from—and plenty of time to make a decision."
61,"""Ah Redfin,"" Glenn Kelman wrote in an all-staff e-mail two weeks ago, ""I'm sorry to say that we're asking about 8% of our employees to leave...""

The online real estate brokerage's CEO went on to announce a sweeping layoff. It was either that or cease to exist...

Redfin (RDFN) stock is down more than 90% since February 2021. And last month, demand came in at 17% less than the brokerage expected.

It's a brutal time in real estate. Last year's manic market has cooled in a matter of months. Mortgage rates have soared, crushing demand.

It might feel like another housing crash is on the horizon. That's what we saw last time around... And it fueled the worst recession of our lifetimes.

Today is different, though. And if you're betting on home prices plummeting soon, you may be stuck waiting.

Let me explain...

Mortgage rates have nearly doubled this year alone. They're nearing a 14-year high. And the Housing Affordability Index explains what that means for the average homebuyer.

This index looks at three ingredients... wages, home prices, and interest rates. These factors determine if folks can afford a house payment or not.

When this index is at 100, a typical American can afford a typical U.S. home. And when it's at 150, they can afford 150% of a home.

The index was more than 150 in the strong boom we saw last year. Today, it's at about 109. That's the lowest reading since 2008.

In other words, we're in a historically tough time to afford a home. And that environment is hurting demand.

New builds are slowing down as a result. The U.S. Census Bureau records the total number of groundbreakings for new homes. As you can see, new housing starts fell more than 14% last month...



May's shortfall undershot expert projections by about 8%.

So affordability is low, and new builds are falling. This may feel like bad news for the housing market. But it doesn't mean home prices will crater...

In fact, the median existing home price reached $407,600 in May – a record high. That's because falling home construction is actually a tailwind for real estate assets.

Take last month's dip in housing starts. It's part of a bigger story: The U.S. just doesn't have enough housing.

The number of homes for sale over the last 20 years bears that out...



U.S. housing is near record scarcity. The National Association of Realtors put numbers to the shortfall last year. It wrote that we need between 5.5 million and 6.8 million units to close the gap.

This shortage will take more than a few months of falling demand to go away. It's a multiyear problem. And it's a backstop to real estate prices.

Instead of a crash, what we may see instead is a dip in how fast home prices are rising...

Home prices soared 20.6% in the year ending this March. And they gained 13.2% the year before that. It has been a furious two-year bull run... But it's also completely unsustainable.

Home prices don't usually grow by double digits. Before 2020, home prices rose less than 4% per year. And a reversion to the typical rate is much likelier than an all-out nosedive.

Of course, something unforeseeable could change the picture. But if you're waiting for a crash to buy a house, there's a good chance you'll be waiting forever... And all the while, home prices will tick upward.

The future may hold surging rates and cooling demand. But until the inventory gap closes, a crash is unlikely."
62,"The housing market has made headline news over the past two years, with countless buyers being priced out of the market. Not only have home prices exploded by as much as 50% in some areas, interest rates have more than doubled off their 2020 lows. This has made housing unaffordable for countless buyers, as the combination of rising prices and interest rates have made the average house payment jump by more than 30%.

This may not seem to be the right time to be looking ahead to where the housing market will be in 10 years, but the truth is that people will always need a place to live. Knowledge is power when it comes to making financial decisions, so here’s a look at what some experts say the housing market will look like in eight years.

Prices Will Be Much Higher

It’s almost a given that in spite of current high prices, houses will cost even more 10 years down the line. According to RenoFi, the cost of a single-family home in the U.S. is likely to hit $382,000 by 2030.

In the near term, even though price growth seems to be slowing, the fact remains that America still faces a shortage of available homes. While rising mortgage rates will likely reduce price growth in the near term, the scales are still tilted toward demand over supply. This imbalance is likely to last at least another year, and possibly two or three, until the combination of rising new builds, higher interest rates and slower investor interest remove some of the demand for homes. 

Especially in California

Quoting the “average” price of a home in the United States doesn’t always provide buyers with information that is relevant. Real estate pricing is always highly regional, and it really does come down to “location, location, location.” If you live in California, the so-called “average” home hasn’t seen $382,000 in decades.

RenoFi projects that by 2030, for example, San Francisco will have the highest average home value in the country, at a whopping $2,612,484. Two other California cities, San Jose and Oakland, expect to price out at $2,251,703 and $1,713,554, respectively.

Save as Much as You Can

Regardless of how high prices seem like they will be down the line, the advice for those looking to buy remains the same as it always has: Save as much as you can. The biggest burden for most homebuyers is not so much the monthly mortgage payment but coming up with enough money for a down payment.

If the average home price across America will be $382,000 by 2030, potential homebuyers should be trying to save up a 20% down payment of $76,400 over the next eight years. On a straight scale, not factoring in inflation or any investment gains, that means you’ll need to save $795.83 per month. Of course, if you live in a high-cost area you’ll have to save more, but this is a good guideline as to the amount of savings you’ll need for the average home. 

Invest Your Savings

To make your journey toward reaching your down payment target easier, the best thing to do with your savings is to invest them. If you could achieve a modest 4% annual return on your money over the next eight years, you’d only need to save about $675 per month, as opposed to $795.83. And if you could earn a 5% return on your investment, your monthly required savings would drop to about $650.

Price Gains and Inflation

Although these price gains may seem astronomical, over a period of eight years, they are more or less expected to keep pace with inflation. When viewed in that light, those price gains are not only normal but relatively modest. This is why investing your savings for a future home purchase can actually give you a substantial leg up.

With prudent investing, your savings could easily outpace the gains in inflation. This means that even though prices are going up while you’re waiting, you’re actually reducing the effective cost of your purchase by increasing the value of your investments.

Is There Still Time To Buy?
If you’re trying to flip a house or looking to move somewhere else within the next two years, you might want to hold off on buying a home for the time being. But if you’re either a long-term investor or plan to reside in one location for 10 years or more, you’re likely still in the clear if you’re looking to buy.

Although prices currently seem high, experts project they will be even higher eight years down the road. While mortgage rates have ticked up rapidly in 2022, they are still trending below long-term averages — and if they fall over the coming years, you’ll have the option to refinance at a lower rate."
