ID,Description
101,"New York’s luxury housing market is shifting after a strong start to 2022.

Sales of New York City condos priced at $10 million and more spiked 84% in the first half of the year compared to the same time in 2021, according to a report Tuesday from SERHANT. Co-op sales rose 100% in the same time period. 

Sales volume totaled $2.17 billion, up from $1.26 billion in the first half of last year and $1.11 billion during the same time period in 2020, the report said. 

“The super-prime market in New York had a robust start to 2022,” Garrett Derderian, director of market intelligence at SERHANT, said in the report. “It was the strongest first-half year since 2019, when an increase to mansion and transfer taxes took effect on July 1, which resulted in a flurry of activity in the first half of that year. Condos also sold at their fastest pace in years.” 

Indeed, the pace of sales has increased as well, with the average property spending 203 days on the market, compared to 328 days last year. There were 127 contracts signed for condos and co-ops priced at $10 million or more in the first half of 2022, slightly less than the 161 reported last year. 

“While the number of trades is slightly below the records set in 2021, the number of super-prime condo contracts is 28% above the rolling 10-year average, while cooperatives trades are down just 8%,” Mr. Derderian wrote. 

The median sales price across all property types was $13.7 million in the first six months of 2022, the report said. 

And while real estate sales in the city have “undeniably slowed over the last two months from the record 2021 year, we still see buyers engaging at this level if the home is priced correctly,” Mr. Derderian added. 

Meanwhile, out east in the Hamptons—the summer retreat for New York’s super-prime set—median prices were up 9% to $14.65 million, the report said. Sales are lagging because of a lack of quality inventory, but buyers are still out there. 

“Turnkey homes are the most in-demand and command the highest price,” Mr. Derderian wrote. “Most buyers across the Hamptons have little appetite to do major renovations in the current market given rising costs and supply chain disruptions. It simply takes too long to complete. This has driven up prices for move-in ready homes. They do not sit on the market for long.”"
102,"It’s easy to conclude from the craziness of New York City’s rental market — including that long line for a tiny, rent-regulated East Village apartment that made The Post’s cover — that what the city needs is more “affordable housing.”

But it’s not true. Not only do New York City and the state overall have more subsidized housing than anywhere else in the nation — we make inefficient use of such housing. And rent regulation is actually helping drive the scarcity and sky-high rents of other units.

To be sure, the sight of wannabe renters waiting more than an hour in hopes of snagging a 371-square-foot, one-bedroom, third-floor walk-up for $2,337 a month would be inconceivable in most of America. Consider that the median mortgage payment in Phoenix is just $1,500 a month — for 2,500 square feet. It’s no wonder the city is losing population to the Sunbelt.

But to conclude that Gotham’s rental market needs more “affordable” — that is, income-restricted — units ignores reality.

New York state has 490,000 subsidized-housing units, the most in the country, per the federal Department of Housing and Urban Development, with some 359,000 units in the city. With 5% of the nation’s population, New York has 10% of directly subsidized housing units — including public housing; housing choice vouchers for individual households renting private units; and rental units in buildings whose construction costs have been subsidized by the federal Low Income Housing Tax credit, which requires a percentage of units be set aside for rental by low- and moderate-income households as defined by median area income.

That staggering number doesn’t even include the more than 1 million rent-stabilized units, whose owners must keep rents low no matter tenant income.

Both directly subsidized and rent-regulated apartments provide good deals for lucky tenants — but wildly distort the overall housing market. A New York University study of New York City rent-regulated units found that 23% of tenants had moved in more than 20 years ago, three times as long a period as in market-rate units. In core Manhattan, fully 30% of rent-regulated tenants had lived in their apartments 20 years or more.

Low turnover means that renters of units that might go on the market in other cities — as older tenants no longer need the space and want to limit their costs — have an incentive to stay put. So newcomers to the city — including those who might have been waiting in the long East Village line — are out of luck.

This isn’t a housing market — it’s a game of apartment musical chairs.

Lucky winners hit what amounts to the housing lottery — a low-rent apartment without time limit. The same is true for those who score a designated new construction “affordable unit,” for which rent regulation kicks in. A change in income doesn’t affect the rent in these units. Tenants could literally hit the state lottery number and see limited rent increases at best from the Rent Guidelines Board, which votes yearly on increases to rent-stabilized units. To say this is an inefficient use of scarce public resources is an understatement.

The public-housing system is no better. HUD reports that 30% of New York City Housing Authority tenants are “overhoused” — meaning they have more bedrooms than they need — even as long waiting lists are the norm. Again there’s no incentive to move so long as one has an artificially cheap apartment.

There are some commonsense solutions. NYCHA could offer buyouts to tenants with extra bedrooms — to make way for homeless families. High-income tenants could be disqualified from rent-stabilized units. Or better still, the whole crazy quilt of rent regulation could be swept away — making New York more like other cities, where housing is not a perennial crisis.

Instead, Gov. Kathy Hochul is pushing for an additional $25 billion in subsidized housing.  Incredibly, the cost of building tax-subsidized affordable units in New York state tops $400,000 — per apartment. That’s thanks to union-dictated prevailing wage laws and the high cost for developers, who must negotiate zoning regulations and political demands.

If housing subsidies were the path to prosperity and widespread affordability, New York state would long ago have achieved both. Instead, it has demonstrated that even the most extensive housing-subsidy program in the nation guarantees neither."
103,"Rising real estate values and increasing rents have stretched budgets for homebuyers and renters over the last two years. The median home sales price in the U.S. jumped by nearly $100,000 from the first quarter of 2020 to the first quarter of 2022 amid low interest rates and a stronger-than-expected pandemic economy. Rents were flat for much of 2020 with COVID-related renter protections and rental assistance programs in place but accelerated in 2021 and the first half of 2022. Median rent in the U.S. has increased by more than 15% over the past year and recently passed $2,000 per month for the first time.

Since the beginning of 2022, the U.S. Federal Reserve has raised interest rates in efforts to combat inflation throughout the economy. Between rising mortgage rates and the rapid run-up in home values, the residential real estate market has shown recent signs of cooling. But while a leveling out in demand could slow the pace of price increases, these measures cannot solve another fundamental challenge in the U.S. housing market: a major shortage of housing supply.

Researchers at federal mortgage backer Freddie Mac have estimated that the U.S. has a housing supply shortage of 3.8 million units. This shortage has been fueled in large part by a decline in single family home construction, particularly for starter homes, dating back to the 1980s. And with millennials now comprising the largest generational segment of the homebuying market, a lack of affordable entry-level homes has driven competition for housing and kept larger numbers of young adults renting, contributing to price increases for buyers and renters alike.

The lack of housing supply has been exacerbated by significant underinvestment in new housing since the last recession. New housing authorizations tend to fall temporarily during economic downturns, but the collapse of the housing market in the mid-2000s and ensuing Great Recession sent annual housing authorizations to historic lows. New housing permits have recovered slowly over the last decade, only recently surpassing historic averages.

Despite recent demand and a clear need for new housing supply, the construction industry has struggled to keep up during the pandemic. COVID-related disruptions have produced worker shortages and hindered supply chains, making it harder and more expensive to obtain building materials. As a result, more single-family units are seeing monthslong delays in the time it takes to start and complete construction when compared to years past.

Although supply is a challenge across the U.S., some locations are moving faster than others in authorizing new construction. Fast-growing states in the Mountain West, like Utah, Idaho, and Colorado, along with Sun Belt destinations like Texas and Florida, lead the U.S. in the rate of new housing authorizations relative to existing homes. At the local level, major cities in these fast-growing states are also among the leading metros for new home construction.

To determine the states building the most homes, researchers at Inspection Support Network analyzed the latest data from the U.S. Census Bureau and Zillow. The researchers ranked states according to the number of new housing units authorized per 1,000 existing homes in 2021. In the event of a tie, the state with higher total new housing units authorized in 2021 was ranked higher.

The analysis found that for every 1,000 existing homes in New York State in 2021, 4.8 new housing units were authorized, compared to 12.5 new units nationally. Out of all states, New York is building homes at the 6th slowest growth rate. Here is a summary of the data for New York State:

New housing units authorized per 1k existing homes (2021): 4.8
New housing units authorized per 1k existing homes (2019): 5.5
Total new housing units authorized (2021): 40,135
Total new housing units authorized (2019): 45,219
Percentage change in housing units authorized (2019–2021): -11.2%
Median home price: $393,063

For reference, here are the statistics for the entire United States:

New housing units authorized per 1k existing homes (2021): 12.5
New housing units authorized per 1k existing homes (2019): 10.2
Total new housing units authorized (2021): 1,736,982
Total new housing units authorized (2019): 1,386,048
Percentage change in housing units authorized (2019–2021): +25.3%
Median home price: $344,141"
104,"(The Center Square) – Despite rising mortgage rates and low inventories, the Illinois real estate market continued its momentum in May.

According to Illinois Realtors, sales were down but prices rose over 6% and homes sold quicker than a year ago. The average Illinois home sold in 24 days in May 2022, compared to 33 days a year ago.

“Prices increased again while the number of sales remains low throughout Illinois,” said Dr. Daniel McMillen, head of the Stuart Handler Department of Real Estate at the University of Illinois at Chicago College of Business Administration. “The SHDRE forecast now indicates an increase in the number of sales over the next three months.”


Two of the hottest housing markets are downstate where sales and prices were up. The median price for a home increased in May year-over-year by 27.3% in the Kankakee area, and 23.4% in the Carbondale/Marion area.

In the Chicago Metro Area, the median home sale price in May 2022 was $327,000, an increase of 5.5% from $310,000 in May 2021.

Industry analysts say higher mortgage rates, which recently climbed to 6%, are likely to eventually douse the relentless escalation of home prices. Fewer buyers are submitting mortgage applications. According to Mortgage Bankers Association data, the decline is over 15% from a year ago.

As for low housing inventories, McMillen said there are still challenges for new construction.

“It has been really difficult for builders to be adding to the housing stock right now,” said McMillen. “There are still these major bottlenecks in supplies.”

With higher interest rates and home prices, Realtor.com economists now predict sales of existing homes will drop 6.7% compared to last year. They note fewer sales could give inventory levels a boost."
105,"Rising interest rates have put somewhat of a damper on San Diego’s resale housing market.

The median price of a single-family home dropped $10,000 in May from $1 million to $990,000, according to the Greater San Diego Association of Realtors, while the median price of condominiums and other forms of attached housing actually rose $10,000 to $670,000.

The price drop for single-family is particularly significant because it comes at a time of year when home sales historically have started to peak, and Association President Chris Anderson said that more cooling is likely as the effect of rising interest rates spreads.

“It isn’t accelerating like it was,” Anderson said.  “It didn’t tank. It kind of leveled. We still have the same number of sales, roughly.”

In May, 1,837 single-family homes were sold compared to 1,061 in April, according to the association.

Predicting that prices will continue to moderate, Anderson said that she doesn’t see a significant drop in prices.

“I don’t see the crash a lot of people say is going to be like 2007 or 2008. I don’t see that,” Anderson said, adding that inventory remains low and demand is strong.

Adjusting Search

Even with the rise in interest rates, Anderson said that she’s still seeing multiple offers on the homes she’s listing, and buyers in some cases are still willing to pay more than the listing price.

“Some things are sticking on the market and other things are flying off the market. It doesn’t matter what the price point is, it’s just whether it’s priced right in its group,” Anderson said.  “We still have a lot of people with a lot of money coming here. We might have a good summer but I don’t know what’s going to happen going into winter.”

Historically, winter is a slow time for housing sales.

While some people were surely priced out of the market by rising interest rates, Anderson said others are adjusting their housing searches.

As a rule, home prices are lower in East County and South County then in Central County and North County.

“If you don’t have the buying power that you once had, you may want to look in those areas and commute a little bit more. You’ll get more bang for your buck if you go inland,” Anderson said.

Fantastic and Challenging

Meanwhile, a national home listing service ranked San Diego near the bottom of the list of the 50 best cities to raise a family primarily because of the high housing prices.

“It’s twice more expensive to live in San Diego compared to the national average,” said Danetha Doe, an economist with Clever Real Estate, a real estate data service.

“It was really the economic factors that unfortunately place San Diego in the bottom 10,” Doe said. “Economically, it seems to be a tough place to raise a family unless a family is on the high end of the (economic) spectrum. If you are, it seems like a fantastic place to raise a family.”

Joining San Diego on Clever’s list of the worst places to raise a family based on economics were Riverside and Los Angeles.

The absolute worst place among U.S. cities surveyed is Detroit, according to Clever.

Topping the list of best places were Hartford, Connecticut; Milwaukee, Wisconsin;  and Providence, Rhode Island."
